{
  "report_version": "bazi-report-structured-v5",
  "engine_version": "bazi-engine-real-calc-py310-v2",
  "rules_version": "bazi-rules-shen-sha-v5",
  "status": "ok",
  "summary": {
    "text": "日主丙；十神已完成明透与藏干映射；基础旺衰评分 v0 结果为 weak/偏弱；月令主气格识别 v1 状态为 candidate_only/月食神格；调候受控版 v0 状态为 candidate_only/春季；流年骨架 v0 状态为 determined/1995-2004；神煞受控版 v0 状态为 determined/0项命中；事业专项受控版 v0 状态为 determined/active/active_breakthrough；财运专项受控版 v0 状态为 determined/active/leverage_growth；婚恋专项受控版 v0 状态为 determined/active；候选用神方法为 candidate_only_v0；最终用神受控版 v0 状态为 determined。",
    "evidence_refs": [
      "E106",
      "E105",
      "E104",
      "E101",
      "E102",
      "E103",
      "E401",
      "E402",
      "E404",
      "E405",
      "E501",
      "E503",
      "E502",
      "E507",
      "E506",
      "E505",
      "E701",
      "E702",
      "E704",
      "E703",
      "E903",
      "E905",
      "E908",
      "E201",
      "E203",
      "E205",
      "E301",
      "E305",
      "E306",
      "E308",
      "E107",
      "E207",
      "E209",
      "E208",
      "E907",
      "E601",
      "E605",
      "E604",
      "E904",
      "E901",
      "E906",
      "E902",
      "E1101",
      "E1102",
      "E1103",
      "E1104",
      "E1105",
      "E1106",
      "E1107",
      "E1201",
      "E1202",
      "E1203",
      "E1204",
      "E1205",
      "E1206",
      "E1207",
      "E1208",
      "E1002",
      "E1003",
      "E1004",
      "E1005",
      "E1006",
      "E1007",
      "E1001"
    ]
  },
  "ten_gods_summary": {
    "day_master": "丙",
    "stems_visible": [
      {
        "pillar": "year",
        "stem": "庚",
        "god": "偏财",
        "is_day_master": false,
        "evidence_refs": [
          "E106",
          "E105"
        ]
      },
      {
        "pillar": "month",
        "stem": "庚",
        "god": "偏财",
        "is_day_master": false,
        "evidence_refs": [
          "E106",
          "E105"
        ]
      },
      {
        "pillar": "day",
        "stem": "丙",
        "god": "day_master",
        "is_day_master": true,
        "evidence_refs": [
          "E106"
        ]
      },
      {
        "pillar": "hour",
        "stem": "庚",
        "god": "偏财",
        "is_day_master": false,
        "evidence_refs": [
          "E106",
          "E105"
        ]
      }
    ],
    "branches_hidden": [
      {
        "pillar": "year",
        "branch": "午",
        "hidden_stems": [
          {
            "stem": "丁",
            "god": "劫财",
            "evidence_refs": [
              "E106",
              "E104"
            ]
          },
          {
            "stem": "己",
            "god": "伤官",
            "evidence_refs": [
              "E106",
              "E104"
            ]
          }
        ]
      },
      {
        "pillar": "month",
        "branch": "辰",
        "hidden_stems": [
          {
            "stem": "戊",
            "god": "食神",
            "evidence_refs": [
              "E106",
              "E104"
            ]
          },
          {
            "stem": "乙",
            "god": "正印",
            "evidence_refs": [
              "E106",
              "E104"
            ]
          },
          {
            "stem": "癸",
            "god": "正官",
            "evidence_refs": [
              "E106",
              "E104"
            ]
          }
        ]
      },
      {
        "pillar": "day",
        "branch": "辰",
        "hidden_stems": [
          {
            "stem": "戊",
            "god": "食神",
            "evidence_refs": [
              "E106",
              "E104"
            ]
          },
          {
            "stem": "乙",
            "god": "正印",
            "evidence_refs": [
              "E106",
              "E104"
            ]
          },
          {
            "stem": "癸",
            "god": "正官",
            "evidence_refs": [
              "E106",
              "E104"
            ]
          }
        ]
      },
      {
        "pillar": "hour",
        "branch": "寅",
        "hidden_stems": [
          {
            "stem": "甲",
            "god": "偏印",
            "evidence_refs": [
              "E106",
              "E104"
            ]
          },
          {
            "stem": "丙",
            "god": "比肩",
            "evidence_refs": [
              "E106",
              "E104"
            ]
          },
          {
            "stem": "戊",
            "god": "食神",
            "evidence_refs": [
              "E106",
              "E104"
            ]
          }
        ]
      }
    ],
    "evidence_refs": [
      "E106",
      "E105",
      "E104"
    ]
  },
  "strength_summary": {
    "score": -5,
    "label": "weak",
    "summary": "偏弱",
    "evidence_refs": [
      "E101",
      "E102",
      "E105",
      "E104",
      "E103"
    ]
  },
  "pattern_system_summary": {
    "method": "month_main_qi_pattern_v1",
    "status": "candidate_only",
    "candidate_pattern": {
      "pattern_key": "yueshishen",
      "pattern_name": "月食神格",
      "source": "month_branch_main_qi",
      "source_name": "月令主气",
      "source_stem": "戊",
      "source_god": "食神",
      "transparency": "hidden_only",
      "evidence_refs": [
        "E106",
        "E104",
        "E401",
        "E402",
        "E404"
      ]
    },
    "final_pattern": null,
    "notes": [
      {
        "text": "当前格局体系受控版 v1 仅识别月令主气格，不扩展到复杂格局、调候、神煞或流年流月。",
        "evidence_refs": [
          "E405"
        ]
      },
      {
        "text": "月令主气为食神，可列为月食神格候选，但当前未见同神透干，仅保留 candidate_pattern。",
        "evidence_refs": [
          "E404"
        ]
      }
    ],
    "evidence_refs": [
      "E106",
      "E104",
      "E401",
      "E402",
      "E404",
      "E405"
    ]
  },
  "climate_balance_summary": {
    "method": "climate_balance_v0",
    "status": "candidate_only",
    "season_context": {
      "month_branch": "辰",
      "season": "spring",
      "season_name": "春",
      "baseline_tendencies": [
        "damp"
      ],
      "detected_tendencies": [
        "cold",
        "dry"
      ],
      "evidence_refs": [
        "E501",
        "E503"
      ]
    },
    "candidate_adjustments": [
      {
        "element": "earth",
        "direction": "drying",
        "priority": 1,
        "reason": "月支辰归于春季，当前季节背景偏湿，可先将土作为燥化方向的调候候选。",
        "evidence_refs": [
          "E501",
          "E502"
        ]
      },
      {
        "element": "fire",
        "direction": "warming",
        "priority": 2,
        "reason": "月支辰归于春季，当前季节背景偏湿，可先将火作为温暖方向的调候候选。 当前五行分布对温暖方向有额外支持。",
        "evidence_refs": [
          "E501",
          "E502",
          "E503"
        ]
      }
    ],
    "notes": [
      {
        "text": "调候受控版 v0 只输出季节寒暖燥湿候选建议，不等同最终用神，也不展开完整传统调候体系。",
        "evidence_refs": [
          "E507"
        ]
      },
      {
        "text": "调候候选只在当前独立层内成立，不能覆盖既有强弱、格局与用神结论。",
        "evidence_refs": [
          "E506"
        ]
      },
      {
        "text": "当前仅能依据月支季节背景给出调候候选，五行分布信号不足以提升确定性。",
        "evidence_refs": [
          "E505"
        ]
      }
    ],
    "evidence_refs": [
      "E501",
      "E503",
      "E502",
      "E507",
      "E506",
      "E505"
    ]
  },
  "annual_flow_summary": {
    "method": "annual_flow_v0",
    "status": "determined",
    "window": {
      "start_year": 1995,
      "end_year": 2004,
      "preview_year_count": 10,
      "start_year_source": "luck_cycle_first_entry_start_year",
      "sequencing_basis": "birth_year_pillar_plus_solar_year_delta"
    },
    "entries": [
      {
        "year": 1995,
        "ganzhi": "乙亥",
        "relative_index": 0,
        "evidence_refs": [
          "E701",
          "E702"
        ]
      },
      {
        "year": 1996,
        "ganzhi": "丙子",
        "relative_index": 1,
        "evidence_refs": [
          "E701",
          "E702"
        ]
      },
      {
        "year": 1997,
        "ganzhi": "丁丑",
        "relative_index": 2,
        "evidence_refs": [
          "E701",
          "E702"
        ]
      },
      {
        "year": 1998,
        "ganzhi": "戊寅",
        "relative_index": 3,
        "evidence_refs": [
          "E701",
          "E702"
        ]
      },
      {
        "year": 1999,
        "ganzhi": "己卯",
        "relative_index": 4,
        "evidence_refs": [
          "E701",
          "E702"
        ]
      },
      {
        "year": 2000,
        "ganzhi": "庚辰",
        "relative_index": 5,
        "evidence_refs": [
          "E701",
          "E702"
        ]
      },
      {
        "year": 2001,
        "ganzhi": "辛巳",
        "relative_index": 6,
        "evidence_refs": [
          "E701",
          "E702"
        ]
      },
      {
        "year": 2002,
        "ganzhi": "壬午",
        "relative_index": 7,
        "evidence_refs": [
          "E701",
          "E702"
        ]
      },
      {
        "year": 2003,
        "ganzhi": "癸未",
        "relative_index": 8,
        "evidence_refs": [
          "E701",
          "E702"
        ]
      },
      {
        "year": 2004,
        "ganzhi": "甲申",
        "relative_index": 9,
        "evidence_refs": [
          "E701",
          "E702"
        ]
      }
    ],
    "notes": [
      {
        "text": "当前流年骨架 v0 仅输出固定窗口内的流年干支序列，不代表吉凶判断、事件预测或流月展开。",
        "evidence_refs": [
          "E704"
        ]
      },
      {
        "text": "已基于出生年柱与大运起运年份，输出固定十年窗口的流年干支骨架。",
        "evidence_refs": [
          "E703"
        ]
      }
    ],
    "evidence_refs": [
      "E701",
      "E702",
      "E704",
      "E703"
    ]
  },
  "annual_reading_summary": {
    "method": "annual_reading_v0",
    "status": "determined",
    "window": {
      "start_year": 2026,
      "end_year": 2030,
      "preview_year_count": 5,
      "reference_year": 2026,
      "reference_year_source": "project_reference_year_v0",
      "sequencing_basis": "birth_year_pillar_plus_solar_year_delta"
    },
    "entries": [
      {
        "year": 2026,
        "ganzhi": "丙午",
        "career_signal": "favorable",